"ID","Kalimat","Kelas"
"494","Saya kira dari 450 Triliun APBN yang 20% dari APBN nasional saya kira prioritas yang harus kita pikirkan adalah bagaimana mereka .","Suggestion"
"495","Maksud saya para guru honorer maupun yang sudah memenuhi syarat menjadi CPNS segera diangkat dan menjadi bagian tak terpisahkan dari pasal-pasal dalam RUU ASN yang akan kita revisi .","Suggestion"
"496","Saya kira 4 point itu Pimpinan .","Suggestion"
"497","Terima kasih atas waktunya .","Other"
"498","Wallahu muafiq ilia aqwa mithoriq,Wassalamu'alaikum WarahmatullahiWabarakaatuh .","Other"
"499","45KETUA RAPAT:Baik .","Other"
"500","Saya kira interupsi kita cukupkan .","Other"
"501","Kita lanjutkan ke acara berikutnya .","Other"
"502","Nanti kita akan bahas lebih lanjut didalam Baleg atau didalam Pansus yang terbentuk .","Other"
"503","Terima kasih .","Other"
"504","Sidang Dewan yang kami hormati,Marilah kita memasuki acara ke-3 Rapat Paripurna hari ini yaitu penetapan kembali tim, Tim yang sebagaimana berikut ini .","Statement"
"505","Tadi sudah saya bacakan juga .","Other"
"506","Pertama, tim pengawas DPR Rl terhadap perlindungan tenaga kerja Indonesia khususnya tenaga kerja di luar negeri .","Opinion"
"507","Sebab kita tahu ada banyak sekali masalah di berbagai belahan dunia yang harus dipantau .","Other"
"508","Yang kedua, tim implementasi reformasi DPR Rl sebagai kelanjutan dari project kita untuk mengimplementasikan konsep parlemen modern .","Request"
"509","Kami melaporkan juga tadi pagi Ketua DPR dan Pimpinan lainnya meresmikan penggunaan nama dan logo baru sistem pendukung DPR yaitu dari Sekretariat Jenderal menjadi Sekretariat Jenderal dan Badan Keahlian DPR .","Request"
"510","Sebab menurut Undang-Undang MD3 kita yang baru dan Peraturan Presiden Nomor 37 Tahun 2015, Presiden telah mengeluarkan peraturan tentang kelembagaan Sekjen dan Badan Keahlian sebagai kelembagaan yang setara .","Request"
"511","Yang ketiga, tim pemantau DPR Rl terhadap pelaksanaan beberapa Undang- Undang yaitu Undang-Undang Nomor 11 Tahun 2006 tentang Pemerintahan Aceh .","Statement"
"512","Kemudian Undang-Undang Nomor 21 tentang Otonomi Khusus Provinsi Papua, serta pelaksanaan Undang-Undang Nomor 13 Tahun 2012 tentang Keistimewaan Yogyakarta .","Statement"
"513","Yang keempat adalah yang sudah ditanyakan tadi tentang pemantauan evaluasi usulan program daerah pemilihan .","Other"
"514","Yang kelima adalah tim tentang penguatan diplomasi parlemen sebagaimana tadi disebutkan juga oleh Ibu Nurhayati sebagai Ketua Badan Kerjasama Antar Parlemen .","Other"
"515","Dan yang terakhir adalah tim pengawas DPR Rl tentang pembangunan wilayah perbatasan .","Other"
"516","Karena kita tahu juga bahwa Undang-Undang tentang daerah perbatasan kita belum ada dan melalui tim ini kita sedang merintis dibentuknya Undang-Undang tentang wilayah perbatasan kita .","Other"
"517","Sesuai hasil dari keputusan Rapat Konsultasi pengganti Rapat Bamus DPR Rl antara Pimpinan DPR dan Pimpinan Fraksi tanggal 18 Januari bahwa ke-6 tim tersebut diumumkan dan disetujui dalam Rapat Paripurna DPR maka berkenaan dengan hal tersebut kami menanyakan kepada seluruh Anggota DPR Rl yang hadir pada hari ini, apakah keenam tim tersebut dapat dilanjutkan masa kerjanya?Setuju?(RAPAT: SETUJU)Terima kasih Bapak/lbu sekalian .","Statement"
"518","46Sidang Dewan yang Kami hormati,Marilah kita memasuki acara terakhir yaitu pengesahan perpanjangan waktu pembahasan RUU tentang sistem perbukuan dan RUU tentang kebudayaan .","Statement"
"519","Berdasarkan ketetapan Pasal 143 Ayat (1) Peraturan DPR Rl Nomor 1 2014 tentang Tata Tertib yang berbunyi ""pembahasan Rancangan Undang-Undang sebagaimana dimaksud pada Pasal 140 Ayat (1) dilakukan dalam jangka waktu 3 kali Masa Sidang dan dapat diperpanjang berdasarkan keputusan Rapat DPR sesuai denganpermintaan tertulis Pimpinan Komisi, Pimpinan Gabungan Komisi, Pimpinan Badan Legislasi, atau Pimpinan Panitia Khusus .","Other"
"520","Berdasarkan laporan dari Pimpinan Komisi X DPR Rl kepada Rapat Konsultasi Pengganti Bamus tanggal 18 Januari 2017, Pimpinan Komisi X DPR Rl meminta perpanjangan waktu 1 kali Masa Sidang maka terhadap permintaan perpanjangan tersebut waktu pembahasan RUU oleh Komisi X DPR Rl tersebut kami meminta persetujuan Rapat Paripurna hari ini, apakah perpanjangan waktu pembahasan RUU tentang Sistem Perbukuan dan RUU tentang Kebudayaan dapat kita setujui?Terima kasih .","Other"
"521","Sidang Dewan yang kami hormati .","Other"
"522","Dengan demikian selesailah acara Rapat Paripurna Dewan hari ini .","Other"
"523","Selaku Pimpinan Dewan hari ini, selaku Pimpinan Rapat kami menyampaikan ucapan terima kasih kepada yang terhormat Anggota Dewan yang hadir dan para hadirin sekalian atas ketekunan dan kesabarannya dalam mengikuti Rapat Paripurna hari ini .","Other"
"524","Dengan seizin Sidang Dewan maka perkenankan kami menutup Rapat Paripurna dengan ucapan Alhamdulillahirrobilalamin .","Other"
"525","Assalamu'alaikum Warahmatullahi Wabarakaatuh .","Other"
"526","(RAPAT: SETUJU)(RAPAT DITUTUP PADA PUKUL 1200 WIB)Jakarta, 24 Januari 2017Ketua Rapats'FAHRl HAMZAH, S. E.  .","Other"
